EKATTE_ID,SETTLEMENT_NAME,AREA(DECARS)
15312,"с. Годешево, общ. Сатовча, обл. Благоевград",11456
15326,"с. Годлево, общ. Разлог, обл. Благоевград",28718
15331,"с. Гоз, общ. Брезник, обл. Перник",12271
15343,"с. Гоздевица, общ. Смолян, обл. Смолян",0
15357,"с. Гоздейка, общ. Дряново, обл. Габрово",0
15374,"с. Голак, общ. Костенец, обл. София",23398
15549,"с. Голем Цалим, общ. Сандански, обл. Благоевград",7848
15432,"с. Голема Раковица, общ. Елин Пелин, обл. София",72065
15446,"с. Голема Фуча, общ. Бобов дол, обл. Кюстендил",14963
15391,"с. Големани, общ. Елена, обл. Велико Търново",0
15401,"с. Големаните, общ. Велико Търново, обл. Велико Търново",12069
15415,"с. Големаново, общ. Кула, обл. Видин",44211
15429,"с. Големанци, общ. Хасково, обл. Хасково",20700
15463,"с. Големи Българени, общ. Дряново, обл. Габрово",0
15480,"с. Големи Станчовци, общ. Трявна, обл. Габрово",0
15494,"с. Големо Бабино, общ. Криводол, обл. Враца",10809
15504,"с. Големо Бучино, общ. Перник, обл. Перник",17974
15518,"с. Големо Малово, общ. Драгоман, обл. София",23676
15535,"с. Големо село, общ. Бобов дол, обл. Кюстендил",15124
15552,"с. Голец, общ. Угърчин, обл. Ловеч",41590
15572,"с. Голеш, общ. Годеч, обл. София",15468
15566,"с. Голеш, общ. Кайнарджа, обл. Силистра",39728
15583,"с. Голешово, общ. Сандански, обл. Благоевград",68367
15597,"с. Голица, общ. Долни чифлик, обл. Варна",48822
15607,"с. Голобрад, общ. Ардино, обл. Кърджали",3547
15610,"с. Голобрадово, общ. Стамболово, обл. Хасково",2173
15457,"с. Голям Върбовник, общ. Бобов дол, обл. Кюстендил",12875
15727,"с. Голям Девесил, общ. Крумовград, обл. Кърджали",5734
15730,"с. Голям Дервент, общ. Елхово, обл. Ямбол",46090
15953,"с. Голям Поровец, общ. Исперих, обл. Разград",22228
15744,"с. Голям дол, общ. Братя Даскалови, обл. Стара Загора",13513
15761,"с. Голям извор, общ. Самуил, обл. Разград",34223
15775,"с. Голям извор, общ. Стамболово, обл. Хасково",14833
15758,"с. Голям извор, общ. Тетевен, обл. Ловеч",32031
15789,"с. Голям манастир, общ. Тунджа, обл. Ямбол",43233
15970,"с. Голям чардак, общ. Съединение, обл. Пловдив",24979
15655,"с. Голяма Брестница, общ. Ябланица, обл. Ловеч",19202
15703,"с. Голяма Желязна, общ. Троян, обл. Ловеч",45657
15713,"с. Голяма Чинка, общ. Крумовград, обл. Кърджали",7568
15641,"с. Голяма бара, общ. Кърджали, обл. Кърджали",1533
15669,"с. Голяма вода, общ. Самуил, обл. Разград",9268
15698,"с. Голяма долина, общ. Маджарово, обл. Хасково",3099
15792,"с. Голямо Асеново, общ. Димитровград, обл. Хасково",20396
15802,"с. Голямо Белово, общ. Белово, обл. Пазарджик",0
15816,"с. Голямо Буково, общ. Средец, обл. Бургас",36320
15829,"с. Голямо Враново, общ. Сливо поле, обл. Русе",26780
15850,"с. Голямо Доляне, общ. Антоново, обл. Търговище",0
15864,"с. Голямо Дряново, общ. Казанлък, обл. Стара Загора",12799
15878,"с. Голямо Каменяне, общ. Крумовград, обл. Кърджали",15417
15881,"с. Голямо Крушево, общ. Болярово, обл. Ямбол",53258
15521,"с. Голямо Пещене, общ. Враца, обл. Враца",32334
15919,"с. Голямо Соколово, общ. Търговище, обл. Търговище",15291
15936,"с. Голямо Чочовени, общ. Сливен, обл. Сливен",21448
15833,"с. Голямо градище, общ. Опака, обл. Търговище",17924
15895,"с. Голямо ново, общ. Търговище, обл. Търговище",20956
15922,"с. Голямо църквище, общ. Омуртаг, обл. Търговище",5162
15984,"с. Голяновци, общ. Костинброд, обл. София",5382
15998,"с. Гомотарци, общ. Видин, обл. Видин",23016
16002,"с. Горан, общ. Ловеч, обл. Ловеч",19760
16016,"с. Горановци, общ. Велико Търново, обл. Велико Търново",0
16026,"с. Горановци, общ. Кюстендил, обл. Кюстендил",20486
16033,"с. Гореме, общ. Струмяни, обл. Благоевград",28200
16047,"с. Горен Еневец, общ. Велико Търново, обл. Велико Търново",0
16050,"с. Горен чифлик, общ. Долни чифлик, обл. Варна",42228
16078,"с. Горица, общ. Бяла, обл. Варна",18263
18575,"с. Горица, общ. Генерал Тошево, обл. Добрич",7313
16064,"с. Горица, общ. Поморие, обл. Бургас",36395
16081,"с. Горица, общ. Попово, обл. Търговище",17783
16095,"с. Горичане, общ. Шабла, обл. Добрич",24534
16105,"с. Горичево, общ. Кубрат, обл. Разград",17033
02782,"с. Горна Арда, общ. Смолян, обл. Смолян",7698
16119,"с. Горна Бела речка, общ. Вършец, обл. Монтана",19975
16122,"с. Горна Бешовица, общ. Мездра, обл. Враца",18793
18513,"с. Горна Биркова, общ. Велинград, обл. Пазарджик",0
16136,"с. Горна Брезница, общ. Кресна, обл. Благоевград",68023
16141,"с. Горна Брестница, общ. Кюстендил, обл. Кюстендил",7724
18561,"с. Горна Василица, общ. Костенец, обл. София",47440
16153,"с. Горна Вереница, общ. Монтана, обл. Монтана",15772
16167,"с. Горна Врабча, общ. Земен, обл. Перник",12631
16170,"с. Горна Глоговица, общ. Земен, обл. Перник",13878
16198,"с. Горна Гращица, общ. Кюстендил, обл. Кюстендил",12153
16208,"с. Горна Диканя, общ. Радомир, обл. Перник",35004
18527,"с. Горна Дъбева, общ. Велинград, обл. Пазарджик",2621
16211,"с. Горна Златица, общ. Антоново, обл. Търговище",9012
16225,"с. Горна Кабда, общ. Търговище, обл. Търговище",6612
16239,"с. Горна Ковачица, общ. Чипровци, обл. Монтана",12051
16242,"с. Горна Козница, общ. Бобов дол, обл. Кюстендил",25401
16256,"с. Горна Кремена, общ. Мездра, обл. Враца",28371
16273,"с. Горна Крушица, общ. Струмяни, обл. Благоевград",19644
16290,"с. Горна Липница, общ. Павликени, обл. Велико Търново",37993
16300,"с. Горна Лука, общ. Чипровци, обл. Монтана",26937
16314,"с. Горна Малина, общ. Горна Малина, обл. София",14064
16331,"с. Горна Мелна, общ. Трън, обл. Перник",16877
16345,"с. Горна Митрополия, общ. Долна Митрополия, обл. Плевен",44583
16362,"с. Горна Рибница, общ. Струмяни, обл. Благоевград",17345
16376,"с. Горна Росица, общ. Севлиево, обл. Габрово",24650
16382,"с. Горна Секирна, общ. Брезник, обл. Перник",14232
16393,"с. Горна Студена, общ. Свищов, обл. Велико Търново",38048
16403,"с. Горна Сушица, общ. Сандански, обл. Благоевград",30129
16417,"с. Горна Хаджийска, общ. Златарица, обл. Велико Търново",0
16420,"с. Горна Хубавка, общ. Омуртаг, обл. Търговище",16225
16267,"с. Горна крепост, общ. Кърджали, обл. Кърджали",5754
16287,"с. Горна кула, общ. Крумовград, обл. Кърджали",11034
16328,"с. Горна махала, общ. Калояново, обл. Пловдив",12778
16448,"с. Горни Богров, общ. Столична, обл. София (столица)",15876
16451,"с. Горни Вадин, общ. Оряхово, обл. Враца",27262
16479,"с. Горни Върпища, общ. Дряново, обл. Габрово",0
16496,"с. Горни Главанак, общ. Маджарово, обл. Хасково",7436
16506,"с. Горни Дамяновци, общ. Трявна, обл. Габрово",0
16513,"с. Горни Домлян, общ. Карлово, обл. Пловдив",11535
16523,"с. Горни Драгойча, общ. Дряново, обл. Габрово",0
16537,"с. Горни Дъбник, общ. Долни Дъбник, обл. Плевен",41658
16554,"с. Горни Коритен, общ. Трекляно, обл. Кюстендил",14887
16571,"с. Горни Лом, общ. Чупрене, обл. Видин",83565
16585,"с. Горни Маренци, общ. Трявна, обл. Габрово",0
16599,"с. Горни Окол, общ. Самоков, обл. София",125672
16609,"с. Горни Радковци, общ. Трявна, обл. Габрово",0
16612,"с. Горни Романци, общ. Брезник, обл. Перник",8539
16626,"с. Горни Танчевци, общ. Елена, обл. Велико Търново",0
16639,"с. Горни Цибър, общ. Вълчедръм, обл. Монтана",33763
16643,"с. Горни Цоневци, общ. Трявна, обл. Габрово",0
16660,"с. Горни Юруци, общ. Крумовград, обл. Кърджали",28650
16568,"с. Горни край, общ. Елена, обл. Велико Търново",0
16540,"с. Горник, общ. Червен бряг, обл. Плевен",23729
16674,"с. Горно Абланово, общ. Борово, обл. Русе",64246
16688,"с. Горно Александрово, общ. Сливен, обл. Сливен",34831
16691,"с. Горно Белево, общ. Братя Даскалови, обл. Стара Загора",17934
16701,"с. Горно Ботево, общ. Стара Загора, обл. Стара Загора",27025
16729,"с. Горно Войводино, общ. Хасково, обл. Хасково",4982
16754,"с. Горно Драглище, общ. Разлог, обл. Благоевград",30838
16763,"с. Горно Дряново, общ. Гърмен, обл. Благоевград",11107
16780,"с. Горно Изворово, общ. Казанлък, обл. Стара Загора",24624
16794,"с. Горно Камарци, общ. Горна Малина, обл. София",31407
18558,"с. Горно Кирково, общ. Кирково, обл. Кърджали",5102
16804,"с. Горно Кобиле, общ. Трекляно, обл. Кюстендил",2590
16818,"с. Горно Козарево, общ. Омуртаг, обл. Търговище",8034
77596,"с. Горно Краище, общ. Белица, обл. Благоевград",6159
16821,"с. Горно Къпиново, общ. Кирково, обл. Кърджали",15679
16835,"с. Горно Луково, общ. Ивайловград, обл. Хасково",12380
16849,"с. Горно Новково, общ. Омуртаг, обл. Търговище",7213
16866,"с. Горно Озирово, общ. Вършец, обл. Монтана",43666
16870,"с. Горно Осеново, общ. Симитли, обл. Благоевград",0
16883,"с. Горно Павликене, общ. Ловеч, обл. Ловеч",37472
16897,"с. Горно Пещене, общ. Враца, обл. Враца",25923
16910,"с. Горно Прахово, общ. Ардино, обл. Кърджали",8191
16924,"с. Горно Сахране, общ. Павел баня, обл. Стара Загора",16795
16969,"с. Горно Спанчево, общ. Сандански, обл. Благоевград",14863
16995,"с. Горно Уйно, общ. Кюстендил, обл. Кюстендил",27057
17004,"с. Горно Хърсово, общ. Благоевград, обл. Благоевград",26442
17018,"с. Горно Церовене, общ. Монтана, обл. Монтана",23034
49076,"с. Горно Черковище, общ. Казанлък, обл. Стара Загора",79430
17035,"с. Горно Ябълково, общ. Средец, обл. Бургас",32178
16732,"с. Горно вършило, общ. Септември, обл. Пазарджик",31928
16852,"с. Горно ново село, общ. Братя Даскалови, обл. Стара Загора",36279
16907,"с. Горно поле, общ. Маджарово, обл. Хасково",15835
16938,"с. Горно село, общ. Драгоман, обл. София",4649
16986,"с. Горно трапе, общ. Троян, обл. Ловеч",7452
16715,"с. Горнова могила, общ. Габрово, обл. Габрово",0
16941,"с. Горноселци, общ. Ивайловград, обл. Хасково",29783
16955,"с. Горнослав, общ. Асеновград, обл. Пловдив",11529
17052,"с. Горово, общ. Смолян, обл. Смолян",10599
17049,"с. Горово, общ. Сунгурларе, обл. Бургас",6404
17066,"с. Гороцвет, общ. Лозница, обл. Разград",18641
17077,"с. Горочевци, общ. Трън, обл. Перник",13538
17097,"с. Горска поляна, общ. Болярово, обл. Ямбол",41060
17083,"с. Горска, общ. Елена, обл. Велико Търново",0
17155,"с. Горски Сеновец, общ. Стражица, обл. Велико Търново",15378
17107,"с. Горски горен Тръмбеш, общ. Горна Оряховица, обл. Велико Търново",14669
17124,"с. Горски долен Тръмбеш, общ. Горна Оряховица, обл. Велико Търново",12766
17141,"с. Горски извор, общ. Димитровград, обл. Хасково",44379
17138,"с. Горски извор, общ. Кирково, обл. Кърджали",15868
17172,"с. Горско Абланово, общ. Опака, обл. Търговище",32303
17186,"с. Горско Дюлево, общ. Момчилград, обл. Кърджали",14946
17192,"с. Горско Калугерово, общ. Сухиндол, обл. Велико Търново",15317
17208,"с. Горско Косово, общ. Сухиндол, обл. Велико Търново",22858
17227,"с. Горско Писарево, общ. Златарица, обл. Велико Търново",0
17244,"с. Горско Сливово, общ. Летница, обл. Ловеч",70028
17213,"с. Горско ново село, общ. Златарица, обл. Велико Търново",24276
17230,"с. Горско село, общ. Омуртаг, обл. Търговище",9436
17169,"с. Горско, общ. Ивайловград, обл. Хасково",6477
17258,"с. Горталово, общ. Плевен, обл. Плевен",14399
17275,"с. Горун, общ. Шабла, обл. Добрич",19558
17289,"с. Горунака, общ. Етрополе, обл. София",0
17302,"с. Горчево, общ. Петрич, обл. Благоевград",0
17316,"с. Горяни, общ. Трявна, обл. Габрово",0
17323,"с. Господиново, общ. Бяла, обл. Варна",38606
17333,"с. Господиново, общ. Кайнарджа, обл. Силистра",15385
17347,"с. Господинци, общ. Гоце Делчев, обл. Благоевград",13353
17350,"с. Гостилица, общ. Дряново, обл. Габрово",32404
17364,"с. Гостиля, общ. Долна Митрополия, обл. Плевен",15624
17378,"с. Гостиня, общ. Ловеч, обл. Ловеч",16492
17381,"с. Гостун, общ. Банско, обл. Благоевград",52425
17405,"с. Градево, общ. Симитли, обл. Благоевград",97505
17419,"с. Градежница, общ. Тетевен, обл. Ловеч",22804
17422,"с. Градец, общ. Видин, обл. Видин",43560
17449,"с. Градец, общ. Костинброд, обл. София",27289
17436,"с. Градец, общ. Котел, обл. Сливен",46099
17453,"с. Градешница, общ. Криводол, обл. Враца",31118
17470,"с. Градина, общ. Долни Дъбник, обл. Плевен",12778
17498,"с. Градина, общ. Лозница, обл. Разград",14654
17484,"с. Градина, общ. Първомай, обл. Пловдив",37275
17508,"с. Градинарово, общ. Провадия, обл. Варна",18690
17511,"с. Градини, общ. Генерал Тошево, обл. Добрич",16205
17556,"с. Градище, общ. Левски, обл. Плевен",38363
17542,"с. Градище, общ. Севлиево, обл. Габрово",26083
17573,"с. Градище, общ. Шумен, обл. Шумен",23302
17587,"с. Градница, общ. Севлиево, обл. Габрово",22652
17590,"с. Градница, общ. Тервел, обл. Добрич",13788
17600,"с. Градско, общ. Сливен, обл. Сливен",26611
17614,"с. Градсковски колиби, общ. Бойница, обл. Видин",9291
17631,"с. Градът, общ. Смолян, обл. Смолян",4256
17659,"с. Грамаде, общ. Дупница, обл. Кюстендил",6185
17676,"с. Грамаде, общ. Рудозем, обл. Смолян",0
17680,"с. Грамаждано, общ. Кюстендил, обл. Кюстендил",6935
17693,"с. Граматиково, общ. Малко Търново, обл. Бургас",85835
17703,"с. Граматици, общ. Елена, обл. Велико Търново",0
17717,"с. Гранит, общ. Братя Даскалови, обл. Стара Загора",32738
17720,"с. Гранитец, общ. Средец, обл. Бургас",13253
17734,"с. Гранитово, общ. Белоградчик, обл. Видин",22820
17748,"с. Гранитово, общ. Елхово, обл. Ямбол",36401
17751,"с. Граница, общ. Кюстендил, обл. Кюстендил",14300
17765,"с. Граничак, общ. Белоградчик, обл. Видин",9426
17779,"с. Граничар, общ. Средец, обл. Бургас",25970
17782,"с. Граничар, общ. Шабла, обл. Добрич",18498
17806,"с. Граф Игнатиево, общ. Марица, обл. Пловдив",28493
17823,"с. Грашево, общ. Велинград, обл. Пазарджик",75558
17837,"с. Гращица, общ. Смолян, обл. Смолян",0
17840,"с. Греевци, общ. Антоново, обл. Търговище",0
17854,"с. Гривица, общ. Плевен, обл. Плевен",35764
17868,"с. Гривка, общ. Крумовград, обл. Кърджали",7834
17871,"с. Гривяк, общ. Кирково, обл. Кърджали",2435
17885,"с. Григорево, общ. Елин Пелин, обл. София",8532
17909,"с. Грозден, общ. Сунгурларе, обл. Бургас",13844
17912,"с. Гроздьово, общ. Долни чифлик, обл. Варна",140349
17943,"с. Громшин, общ. Бойчиновци, обл. Монтана",17426
17957,"с. Грохотно, общ. Девин, обл. Смолян",22373
17988,"с. Груево, общ. Момчилград, обл. Кърджали",10302
17991,"с. Гръблевци, общ. Габрово, обл. Габрово",14839
18006,"с. Грълска падина, общ. Драгоман, обл. София",2634
18018,"с. Грънчарово, общ. Дулово, обл. Силистра",28876
18037,"с. Губеш, общ. Годеч, обл. София",23842
18040,"с. Губислав, общ. Своге, обл. София",23208
18054,"с. Гугутка, общ. Ивайловград, обл. Хасково",25248
18068,"с. Гудевица, общ. Смолян, обл. Смолян",0
18071,"с. Гулийка, общ. Крумовград, обл. Кърджали",4300
18085,"с. Гулия, общ. Крумовград, обл. Кърджали",5786
18109,"с. Гумощник, общ. Троян, обл. Ловеч",17645
18112,"с. Гурбановци, общ. Кюстендил, обл. Кюстендил",5721
18126,"с. Гургулица, общ. Момчилград, обл. Кърджали",25766
18133,"с. Гургулят, общ. Сливница, обл. София",10419
18160,"с. Гурково, общ. Балчик, обл. Добрич",55927
18143,"с. Гурково, общ. Ботевград, обл. София",18915
18174,"с. Гурмазово, общ. Божурище, обл. София",18942
18188,"с. Гусла, общ. Каолиново, обл. Шумен",8097
18191,"с. Гуслар, общ. Тервел, обл. Добрич",14686
18201,"с. Гуцал, общ. Самоков, обл. София",31930
18215,"с. Гъбене, общ. Габрово, обл. Габрово",28492
18229,"с. Гълъбец, общ. Поморие, обл. Бургас",13264
18232,"с. Гълъбец, общ. Хасково, обл. Хасково",8243
18259,"с. Гълъбинци, общ. Тунджа, обл. Ямбол",38792
18263,"с. Гълъбник, общ. Радомир, обл. Перник",22971
00850,"с. Гълъбово, общ. Баните, обл. Смолян",19289
15638,"с. Гълъбово, общ. Белица, обл. Благоевград",4471
18277,"с. Гълъбово, общ. Куклен, обл. Пловдив",16905
18294,"с. Гълъбовци, общ. Сливница, обл. София",18067
18304,"с. Гъмзово, общ. Брегово, обл. Видин",22980
18318,"с. Гърбино, общ. Кюстендил, обл. Кюстендил",15796
18321,"с. Гърбище, общ. Ардино, обл. Кърджали",14494
18335,"с. Гърдевци, общ. Елена, обл. Велико Търново",0
18349,"с. Гърло, общ. Брезник, обл. Перник",9188
18352,"с. Гърляно, общ. Кюстендил, обл. Кюстендил",11851
18366,"с. Гърмен, общ. Гърмен, обл. Благоевград",16232
18374,"с. Гърнати, общ. Неделино, обл. Смолян",7875
18397,"с. Гърня, общ. Дряново, обл. Габрово",0
18407,"с. Гърчиново, общ. Опака, обл. Търговище",17778
18410,"с. Гъсково, общ. Кърджали, обл. Кърджали",2583
18424,"с. Гьоврен, общ. Девин, обл. Смолян",29293
18455,"с. Гюешево, общ. Кюстендил, обл. Кюстендил",17256
18469,"с. Гюльовца, общ. Несебър, обл. Бургас",25425
18486,"с. Гюргич, общ. Ружинци, обл. Видин",33350
20027,"с. Давери, общ. Елена, обл. Велико Търново",0
20033,"с. Давидково, общ. Баните, обл. Смолян",17160
20047,"с. Давидово, общ. Кайнарджа, обл. Силистра",9058
20050,"с. Давидово, общ. Търговище, обл. Търговище",10056
20064,"с. Дагоново, общ. Белица, обл. Благоевград",15802
20078,"с. Даевци, общ. Трявна, обл. Габрово",0
20081,"с. Дайновци, общ. Елена, обл. Велико Търново",0
20105,"с. Дамяница, общ. Сандански, обл. Благоевград",5329
20119,"с. Дамяново, общ. Севлиево, обл. Габрово",25665
20153,"с. Даскал-Атанасово, общ. Раднево, обл. Стара Загора",19172
