EKATTE_ID,SETTLEMENT_NAME,AREA(DECARS)
37006,"с. Кисьовци, общ. Велико Търново, обл. Велико Търново",0
37010,"с. Китанчево, общ. Исперих, обл. Разград",21926
37037,"с. Китен, общ. Провадия, обл. Варна",12336
37040,"с. Китино, общ. Антоново, обл. Търговище",11471
37068,"с. Китка, общ. Аврен, обл. Варна",14419
37071,"с. Китна, общ. Кирково, обл. Кърджали",7613
37085,"с. Китница, общ. Ардино, обл. Кърджали",11586
37099,"с. Кичево, общ. Аксаково, обл. Варна",26267
37109,"с. Киченица, общ. Разград, обл. Разград",12978
37126,"с. Кладенец, общ. Стамболово, обл. Хасково",8037
37135,"с. Кладенец, общ. Шумен, обл. Шумен",9644
37143,"с. Кладенци, общ. Петрич, обл. Благоевград",5481
37157,"с. Кладенци, общ. Тервел, обл. Добрич",19166
37160,"с. Кладни дял, общ. Велико Търново, обл. Велико Търново",0
37174,"с. Кладница, общ. Перник, обл. Перник",15414
37188,"с. Кладоруб, общ. Димово, обл. Видин",10873
41232,"с. Кленовик, общ. Радомир, обл. Перник",10180
37191,"с. Клепало, общ. Струмяни, обл. Благоевград",9882
37201,"с. Кликач, общ. Карнобат, обл. Бургас",19205
37215,"с. Климаш, общ. Сунгурларе, обл. Бургас",15995
37232,"с. Климент, общ. Каолиново, обл. Шумен",25722
37229,"с. Климент, общ. Карлово, обл. Пловдив",39180
37246,"с. Климентово, общ. Аксаково, обл. Варна",33354
41246,"с. Климентово, общ. Полски Тръмбеш, обл. Велико Търново",19117
37263,"с. Клисура, общ. Благоевград, обл. Благоевград",19136
37294,"с. Клисура, общ. Самоков, обл. София",30192
37280,"с. Клисура, общ. Столична, обл. София (столица)",17672
37304,"с. Клисурица, общ. Монтана, обл. Монтана",14323
37321,"с. Клокотница, общ. Хасково, обл. Хасково",16678
37335,"с. Клъшка река, общ. Велико Търново, обл. Велико Търново",0
37349,"с. Ключ, общ. Петрич, обл. Благоевград",17883
37352,"с. Кметовци, общ. Габрово, обл. Габрово",17370
37366,"с. Кметчета, общ. Габрово, обл. Габрово",0
37383,"с. Книжовник, общ. Хасково, обл. Хасково",18689
37397,"с. Княжева махала, общ. Брусарци, обл. Монтана",5098
37407,"с. Княжево, общ. Тополовград, обл. Хасково",24840
61791,"с. Княжевско, общ. Опан, обл. Стара Загора",15496
37410,"с. Кобилино, общ. Ивайловград, обл. Хасково",25508
37424,"с. Кобиляк, общ. Бойчиновци, обл. Монтана",12271
37438,"с. Кобиляне, общ. Кърджали, обл. Кърджали",11429
37455,"с. Ковач, общ. Раднево, обл. Стара Загора",6828
37469,"с. Ковачевец, общ. Попово, обл. Търговище",35847
37472,"с. Ковачевица, общ. Гърмен, обл. Благоевград",117060
37507,"с. Ковачево, общ. Раднево, обл. Стара Загора",46709
37486,"с. Ковачево, общ. Сандански, обл. Благоевград",30676
37491,"с. Ковачево, общ. Септември, обл. Пазарджик",13328
37513,"с. Ковачевци, общ. Ковачевци, обл. Перник",9812
37527,"с. Ковачевци, общ. Самоков, обл. София",63900
37530,"с. Ковачите, общ. Сливен, обл. Сливен",26648
37544,"с. Ковачица, общ. Лом, обл. Монтана",57578
37558,"с. Ковил, общ. Крумовград, обл. Кърджали",2278
37561,"с. Коевци, общ. Сухиндол, обл. Велико Търново",22514
37575,"с. Коевци, общ. Трявна, обл. Габрово",0
37592,"с. Кожари, общ. Борино, обл. Смолян",10147
37602,"с. Кожинци, общ. Трън, обл. Перник",12727
37616,"с. Кожлювци, общ. Елена, обл. Велико Търново",0
37622,"с. Кожухарци, общ. Крумовград, обл. Кърджали",5762
37633,"с. Козаново, общ. Асеновград, обл. Пловдив",14696
37647,"с. Козар Белене, общ. Левски, обл. Плевен",27146
37650,"с. Козаре, общ. Карнобат, обл. Бургас",11338
37664,"с. Козаревец, общ. Лясковец, обл. Велико Търново",20021
37678,"с. Козаревец, общ. Стара Загора, обл. Стара Загора",18964
37681,"с. Козарево, общ. Тунджа, обл. Ямбол",11010
37695,"с. Козарка, общ. Неделино, обл. Смолян",3865
37705,"с. Козарско, общ. Брацигово, обл. Пазарджик",12571
37722,"с. Кози рог, общ. Габрово, обл. Габрово",16576
37736,"с. Козица, общ. Джебел, обл. Кърджали",5456
37748,"с. Козица, общ. Попово, обл. Търговище",8483
37753,"с. Козичино, общ. Поморие, обл. Бургас",98368
37767,"с. Козлево, общ. Кирково, обл. Кърджали",1262
37770,"с. Козлец, общ. Хасково, обл. Хасково",8698
37784,"с. Козловец, общ. Свищов, обл. Велико Търново",60955
37808,"с. Козлодуйци, общ. Добрич-селска, обл. Добрич",23696
37811,"с. Козма презвитер, общ. Омуртаг, обл. Търговище",12141
37825,"с. Козница, общ. Несебър, обл. Бургас",8958
37842,"с. Козя река, общ. Елена, обл. Велико Търново",0
37839,"с. Козяк, общ. Дулово, обл. Силистра",4119
37856,"с. Коиловци, общ. Плевен, обл. Плевен",44917
37890,"с. Койчовци, общ. Трявна, обл. Габрово",0
37914,"с. Кокаляне, общ. Столична, обл. София (столица)",15598
37928,"с. Кокиче, общ. Кърджали, обл. Кърджали",3190
37959,"с. Кокорци, общ. Рудозем, обл. Смолян",0
37962,"с. Кокошане, общ. Кърджали, обл. Кърджали",6691
37976,"с. Колари, общ. Елена, обл. Велико Търново",0
37993,"с. Коларово, общ. Главиница, обл. Силистра",21392
37989,"с. Коларово, общ. Петрич, обл. Благоевград",30299
38008,"с. Коларово, общ. Раднево, обл. Стара Загора",24939
38011,"с. Коларово, общ. Харманли, обл. Хасково",19380
38025,"с. Коларци, общ. Тервел, обл. Добрич",21582
38039,"с. Колена, общ. Стара Загора, обл. Стара Загора",23630
38042,"с. Колец, общ. Минерални бани, обл. Хасково",8338
38056,"с. Колибите, общ. Струмяни, обл. Благоевград",8910
38060,"с. Колишовци, общ. Габрово, обл. Габрово",0
38073,"с. Колобър, общ. Дулово, обл. Силистра",13326
38090,"с. Колю Ганев, общ. Трявна, обл. Габрово",0
38100,"с. Колю Мариново, общ. Братя Даскалови, обл. Стара Загора",27940
38131,"с. Комарево, общ. Берковица, обл. Монтана",7503
38128,"с. Комарево, общ. Бяла Слатина, обл. Враца",20239
38145,"с. Комарево, общ. Долна Митрополия, обл. Плевен",61020
38114,"с. Комарево, общ. Провадия, обл. Варна",20054
38159,"с. Комощица, общ. Якимово, обл. Монтана",41131
38162,"с. Комунари, общ. Дългопол, обл. Варна",15060
38176,"с. Комунига, общ. Черноочене, обл. Кърджали",26665
38186,"с. Комщица, общ. Годеч, обл. София",47244
38193,"с. Конак, общ. Попово, обл. Търговище",23465
38217,"с. Конаре, общ. Генерал Тошево, обл. Добрич",12539
38203,"с. Конаре, общ. Гурково, обл. Стара Загора",39741
38220,"с. Конарско, общ. Якоруда, обл. Благоевград",18920
38234,"с. Конарското, общ. Трявна, обл. Габрово",0
38248,"с. Кондово, общ. Ивайловград, обл. Хасково",3537
38251,"с. Кондолово, общ. Царево, обл. Бургас",49793
38265,"с. Кондофрей, общ. Радомир, обл. Перник",16951
38279,"с. Коневец, общ. Тунджа, обл. Ямбол",20993
38306,"с. Конево, общ. Върбица, обл. Шумен",9798
38296,"с. Конево, общ. Исперих, обл. Разград",18595
38282,"с. Конево, общ. Кърджали, обл. Кърджали",7309
38317,"с. Конници, общ. Ивайловград, обл. Хасково",20503
38323,"с. Коноп, общ. Антоново, обл. Търговище",5252
41126,"с. Конска, общ. Брезник, обл. Перник",12792
38337,"с. Константин, общ. Елена, обл. Велико Търново",32435
38340,"с. Константиновец, общ. Раднево, обл. Стара Загора",12274
38354,"с. Константиново, общ. Варна, обл. Варна",32358
52279,"с. Константиново, общ. Камено, обл. Бургас",21816
38368,"с. Константиново, общ. Симеоновград, обл. Хасково",20346
38371,"с. Контил, общ. Джебел, обл. Кърджали",3700
38385,"с. Конуш, общ. Асеновград, обл. Пловдив",28071
38399,"с. Конуш, общ. Хасково, обл. Хасково",20249
38409,"с. Конче, общ. Момчилград, обл. Кърджали",6871
41188,"с. Коньовец, общ. Шумен, обл. Шумен",20245
38426,"с. Коньово, общ. Нова Загора, обл. Сливен",31698
38432,"с. Коняво, общ. Кюстендил, обл. Кюстендил",13102
38460,"с. Копаница, общ. Радомир, обл. Перник",13060
38488,"с. Копиловци, общ. Георги Дамяново, обл. Монтана",50850
38474,"с. Копиловци, общ. Кюстендил, обл. Кюстендил",3454
38491,"с. Копитник, общ. Черноочене, обл. Кърджали",0
38501,"с. Копрец, общ. Търговище, обл. Търговище",11623
38515,"с. Коприва, общ. Кюстендил, обл. Кюстендил",9471
38529,"с. Копривец, общ. Бяла, обл. Русе",41907
38532,"с. Копривлен, общ. Хаджидимово, обл. Благоевград",27734
38563,"с. Копринка, общ. Казанлък, обл. Стара Загора",21497
38577,"с. Копчелиите, общ. Габрово, обл. Габрово",7385
38580,"с. Корен, общ. Хасково, обл. Хасково",8528
38594,"с. Кориите, общ. Мадан, обл. Смолян",0
38604,"с. Коритата, общ. Рудозем, обл. Смолян",0
38618,"с. Коритен, общ. Крушари, обл. Добрич",23685
38621,"с. Корията, общ. Севлиево, обл. Габрово",0
38635,"с. Коркина, общ. Бобов дол, обл. Кюстендил",19343
38652,"с. Кормянско, общ. Севлиево, обл. Габрово",24858
38666,"с. Корница, общ. Гоце Делчев, обл. Благоевград",63584
38683,"с. Кортен, общ. Нова Загора, обл. Сливен",52006
38697,"с. Кос, общ. Момчилград, обл. Кърджали",2929
38707,"с. Косара, общ. Главиница, обл. Силистра",10682
38710,"с. Косарка, общ. Дряново, обл. Габрово",14951
38724,"с. Косача, общ. Ковачевци, обл. Перник",13344
38738,"с. Косевци, общ. Елена, обл. Велико Търново",0
38741,"с. Косилка, общ. Дряново, обл. Габрово",0
38769,"с. Косовец, общ. Поморие, обл. Бургас",6757
38799,"с. Косово, общ. Асеновград, обл. Пловдив",28449
38772,"с. Косово, общ. Брегово, обл. Видин",15673
38804,"с. Косово, общ. Каспичан, обл. Шумен",22050
38786,"с. Косово, общ. Трекляно, обл. Кюстендил",24690
38858,"с. Коста Перчево, общ. Кула, обл. Видин",17263
38813,"с. Костадините, общ. Габрово, обл. Габрово",0
41191,"с. Костадинкино, общ. Ихтиман, обл. София",0
38830,"с. Костанденец, общ. Цар Калоян, обл. Разград",39379
38861,"с. Костел, общ. Елена, обл. Велико Търново",56151
38875,"с. Костелево, общ. Враца, обл. Враца",22631
38889,"с. Костен, общ. Сунгурларе, обл. Бургас",22513
38892,"с. Костена река, общ. Шумен, обл. Шумен",11553
38916,"с. Костенец, общ. Костенец, обл. София",109381
38920,"с. Костенковци, общ. Габрово, обл. Габрово",0
38933,"с. Костенци, общ. Берковица, обл. Монтана",19053
38947,"с. Кости, общ. Царево, обл. Бургас",76639
38950,"с. Костиево, общ. Марица, обл. Пловдив",23695
38964,"с. Костилково, общ. Ивайловград, обл. Хасково",25578
38981,"с. Костино, общ. Кърджали, обл. Кърджали",2944
38995,"с. Костичовци, общ. Димово, обл. Видин",21682
39001,"с. Костур, общ. Свиленград, обл. Хасково",30194
39013,"с. Костурино, общ. Кирково, обл. Кърджали",0
39027,"с. Костуринци, общ. Трън, обл. Перник",11866
39044,"с. Котеновци, общ. Берковица, обл. Монтана",27544
39058,"с. Котлари, общ. Крумовград, обл. Кърджали",5568
39061,"с. Котленци, общ. Добрич-селска, обл. Добрич",15579
39075,"с. Котуци, общ. Елена, обл. Велико Търново",0
39089,"с. Кочан, общ. Сатовча, обл. Благоевград",32783
39092,"с. Кочани, общ. Неделино, обл. Смолян",3862
39102,"с. Кочево, общ. Садово, обл. Пловдив",6720
39127,"с. Кочмар, общ. Тервел, обл. Добрич",26146
39133,"с. Кочово, общ. Велики Преслав, обл. Шумен",27546
39147,"с. Кошава, общ. Видин, обл. Видин",12618
39150,"с. Кошарево, общ. Брезник, обл. Перник",23774
41251,"с. Кошарите, общ. Радомир, обл. Перник",5053
39164,"с. Кошарица, общ. Несебър, обл. Бургас",48478
39178,"с. Кошарна, общ. Сливо поле, обл. Русе",17296
39181,"с. Кошница, общ. Смолян, обл. Смолян",10444
39195,"с. Кошничари, общ. Търговище, обл. Търговище",11837
39205,"с. Кошов, общ. Иваново, обл. Русе",29561
39222,"с. Кравино, общ. Опан, обл. Стара Загора",11747
39236,"с. Краводер, общ. Криводол, обл. Враца",26597
39242,"с. Крагулево, общ. Добрич-селска, обл. Добрич",20343
39267,"с. Краево, общ. Ботевград, обл. София",15226
39270,"с. Краище, общ. Белица, обл. Благоевград",10523
39284,"с. Краище, общ. Генерал Тошево, обл. Добрич",17744
39298,"с. Крайгорци, общ. Върбица, обл. Шумен",10260
39311,"с. Крайна, общ. Мадан, обл. Смолян",0
41277,"с. Крайна, общ. Неделино, обл. Смолян",0
39325,"с. Крайни дол, общ. Дупница, обл. Кюстендил",3160
39339,"с. Крайници, общ. Дупница, обл. Кюстендил",42447
39342,"с. Крайно село, общ. Кърджали, обл. Кърджали",1136
39356,"с. Крайново, общ. Болярово, обл. Ямбол",23822
39368,"с. Крайполе, общ. Антоново, обл. Търговище",5838
39373,"с. Кракра, общ. Вълчи дол, обл. Варна",11016
39387,"с. Кралев дол, общ. Перник, обл. Перник",14618
39400,"с. Кралево, общ. Стамболово, обл. Хасково",9123
39390,"с. Кралево, общ. Търговище, обл. Търговище",22201
39428,"с. Крали Марко, общ. Пазарджик, обл. Пазарджик",6981
39431,"с. Крамолин, общ. Севлиево, обл. Габрово",44873
39445,"с. Кран, общ. Кирково, обл. Кърджали",4247
39459,"с. Кранево, общ. Балчик, обл. Добрич",16500
39462,"с. Краново, общ. Кайнарджа, обл. Силистра",35455
39483,"с. Крапец, общ. Мездра, обл. Враца",8602
39493,"с. Крапец, общ. Шабла, обл. Добрич",22175
39503,"с. Крапчене, общ. Монтана, обл. Монтана",21312
39517,"с. Красава, общ. Брезник, обл. Перник",7528
39548,"с. Красен дол, общ. Никола Козлево, обл. Шумен",28611
39534,"с. Красен, общ. Генерал Тошево, обл. Добрич",35074
39520,"с. Красен, общ. Иваново, обл. Русе",30858
39551,"с. Красимир, общ. Дългопол, обл. Варна",9509
39565,"с. Красино, общ. Крумовград, обл. Кърджали",12427
39582,"с. Красно градище, общ. Сухиндол, обл. Велико Търново",8485
39579,"с. Красново, общ. Хисаря, обл. Пловдив",54394
39596,"с. Красноселци, общ. Омуртаг, обл. Търговище",8696
39606,"с. Крачимир, общ. Белоградчик, обл. Видин",25811
39614,"с. Кремен, общ. Банско, обл. Благоевград",61869
41174,"с. Кремен, общ. Кирково, обл. Кърджали",12656
39623,"с. Кремена, общ. Балчик, обл. Добрич",17885
39637,"с. Кремене, общ. Смолян, обл. Смолян",20312
80131,"с. Кременец, общ. Момчилград, обл. Кърджали",5967
39640,"с. Кременик, общ. Дупница, обл. Кюстендил",7004
39668,"с. Крепост, общ. Димитровград, обл. Хасково",33170
39671,"с. Крепча, общ. Опака, обл. Търговище",13173
39685,"с. Креслювци, общ. Трявна, обл. Габрово",0
39712,"с. Крета, общ. Гулянци, обл. Плевен",15476
39709,"с. Крета, общ. Мездра, обл. Враца",5754
39726,"с. Крибул, общ. Сатовча, обл. Благоевград",11029
39743,"с. Крива бара, общ. Брусарци, обл. Монтана",26818
39730,"с. Крива бара, общ. Козлодуй, обл. Враца",15542
39757,"с. Крива круша, общ. Нова Загора, обл. Сливен",10965
39760,"с. Крива река, общ. Никола Козлево, обл. Шумен",16751
39791,"с. Кривина, общ. Столична, обл. София (столица)",10739
39788,"с. Кривина, общ. Ценово, обл. Русе",27342
39801,"с. Кривини, общ. Долни чифлик, обл. Варна",13516
39815,"с. Кривица, общ. Самуил, обл. Разград",16819
39832,"с. Кривня, общ. Ветово, обл. Русе",33482
39829,"с. Кривня, общ. Провадия, обл. Варна",34597
39863,"с. Криво поле, общ. Хасково, обл. Хасково",39090
39855,"с. Кривонос, общ. Брезник, обл. Перник",6295
39877,"с. Крилатица, общ. Кирково, обл. Кърджали",17001
39880,"с. Крилювци, общ. Елена, обл. Велико Търново",0
39894,"с. Крин, общ. Кърджали, обл. Кърджали",4497
39918,"с. Крислово, общ. Марица, обл. Пловдив",6743
39935,"с. Кромидово, общ. Петрич, обл. Благоевград",4797
39949,"с. Крояч, общ. Лозница, обл. Разград",10628
39952,"с. Кроячево, общ. Ардино, обл. Кърджали",5183
39966,"с. Крум, общ. Димитровград, обл. Хасково",9329
40021,"с. Крумово градище, общ. Карнобат, обл. Бургас",26903
39983,"с. Крумово, общ. Аксаково, обл. Варна",29911
39997,"с. Крумово, общ. Кочериново, обл. Кюстендил",9721
40004,"с. Крумово, общ. Родопи, обл. Пловдив",19269
40018,"с. Крумово, общ. Тунджа, обл. Ямбол",31276
40035,"с. Крумчевци, общ. Елена, обл. Велико Търново",0
40049,"с. Крупен, общ. Каварна, обл. Добрич",17426
40052,"с. Крупник, общ. Симитли, обл. Благоевград",35412
40066,"с. Круша, общ. Аврен, обл. Варна",9158
40070,"с. Круша, общ. Драгоман, обл. София",7768
40083,"с. Крушаре, общ. Сливен, обл. Сливен",29134
40097,"с. Крушари, общ. Крушари, обл. Добрич",18081
40110,"с. Крушев дол, общ. Мадан, обл. Смолян",0
40124,"с. Крушевец, общ. Созопол, обл. Бургас",52940
40138,"с. Крушево, общ. Гърмен, обл. Благоевград",12495
40155,"с. Крушево, общ. Първомай, обл. Пловдив",15088
40141,"с. Крушево, общ. Севлиево, обл. Габрово",39022
40169,"с. Крушевска, общ. Кърджали, обл. Кърджали",1988
40172,"с. Крушето, общ. Горна Оряховица, обл. Велико Търново",17818
40186,"с. Крушка, общ. Кърджали, обл. Кърджали",3608
40195,"с. Крушовене, общ. Долна Митрополия, обл. Плевен",60139
40213,"с. Крушовица, общ. Долни Дъбник, обл. Плевен",36868
40227,"с. Крушовица, общ. Елин Пелин, обл. София",14458
40200,"с. Крушовица, общ. Мизия, обл. Враца",50490
40230,"с. Крушово, общ. Карнобат, обл. Бургас",22984
40244,"с. Крушово, общ. Лъки, обл. Пловдив",0
40258,"с. Крушолак, общ. Антоново, обл. Търговище",9578
40261,"с. Крушуна, общ. Летница, обл. Ловеч",19981
40275,"с. Кръвеник, общ. Севлиево, обл. Габрово",56948
40302,"с. Крънджилица, общ. Петрич, обл. Благоевград",18075
40316,"с. Крънча, общ. Дряново, обл. Габрово",0
41136,"с. Кръстава, общ. Велинград, обл. Пазарджик",159748
40326,"с. Кръстатица, общ. Баните, обл. Смолян",6947
40333,"с. Кръстевич, общ. Хисаря, обл. Пловдив",46777
40350,"с. Кръстеняците, общ. Трявна, обл. Габрово",0
40364,"с. Кръстец, общ. Трявна, обл. Габрово",0
40378,"с. Кръстилци, общ. Сандански, обл. Благоевград",22911
40381,"с. Кръстина, общ. Камено, обл. Бургас",19831
40395,"с. Кръшно, общ. Търговище, обл. Търговище",16850
40419,"с. Кубадин, общ. Средец, обл. Бургас",28498
40436,"с. Кубратово, общ. Столична, обл. София (столица)",8668
40441,"с. Куделин, общ. Брегово, обл. Видин",7556
