EKATTE_ID,SETTLEMENT_NAME,AREA(DECARS)
61563,"с. Радойново, общ. Средец, обл. Бургас",16366
61580,"с. Радомирци, общ. Червен бряг, обл. Плевен",41166
61594,"с. Радотина, общ. Ботевград, обл. София",19688
61604,"с. Радуил, общ. Самоков, обл. София",76743
61618,"с. Радуй, общ. Перник, обл. Перник",14445
61621,"с. Радуловци, общ. Сливница, обл. София",9553
61635,"с. Радунци, общ. Мъглиж, обл. Стара Загора",0
69523,"с. Радювене, общ. Ловеч, обл. Ловеч",71810
61649,"с. Раевци, общ. Трявна, обл. Габрово",0
63536,"с. Раждавица, общ. Кюстендил, обл. Кюстендил",15562
61652,"с. Разбоище, общ. Годеч, обл. София",7063
61666,"с. Разбойна, общ. Руен, обл. Бургас",13979
61676,"с. Разбойна, общ. Търговище, обл. Търговище",0
61697,"с. Развигорово, общ. Хитрино, обл. Шумен",16134
61707,"с. Разград, общ. Вълчедръм, обл. Монтана",47159
61724,"с. Раздел, общ. Дулово, обл. Силистра",14333
61738,"с. Раздел, общ. Елхово, обл. Ямбол",45561
61741,"с. Разделна, общ. Белослав, обл. Варна",5394
61755,"с. Разделна, общ. Гълъбово, обл. Стара Загора",15999
61769,"с. Разделци, общ. Антоново, обл. Търговище",11310
61772,"с. Раздол, общ. Струмяни, обл. Благоевград",13077
61807,"с. Разлив, общ. Правец, обл. София",16946
61830,"с. Разсоха, общ. Златарица, обл. Велико Търново",9914
61844,"с. Райкова могила, общ. Свиленград, обл. Хасково",21976
61861,"с. Райковци, общ. Велико Търново, обл. Велико Търново",39530
61875,"с. Райнино, общ. Исперих, обл. Разград",23027
61889,"с. Райново, общ. Димитровград, обл. Хасково",8157
61902,"с. Райновци, общ. Габрово, обл. Габрово",0
61892,"с. Райновци, общ. Елена, обл. Велико Търново",0
61916,"с. Райнушковци, общ. Трявна, обл. Габрово",0
61922,"с. Райово, общ. Самоков, обл. София",38901
61933,"с. Ракево, общ. Криводол, обл. Враца",24423
61947,"с. Ракиловци, общ. Ковачевци, обл. Перник",12771
61964,"с. Ракита, общ. Сливница, обл. София",14880
61950,"с. Ракита, общ. Червен бряг, обл. Плевен",52722
61978,"с. Ракитна, общ. Симитли, обл. Благоевград",11931
63700,"с. Ракитница, общ. Брегово, обл. Видин",16338
61995,"с. Ракитница, общ. Стара Загора, обл. Стара Загора",20360
62013,"с. Раклиново, общ. Айтос, обл. Бургас",16696
62027,"с. Раклица, общ. Карнобат, обл. Бургас",34388
62044,"с. Раковица, общ. Макреш, обл. Видин",58496
62058,"с. Раково, общ. Невестино, обл. Кюстендил",51001
62061,"с. Раково, общ. Сливен, обл. Сливен",47285
62092,"с. Раковски, общ. Каварна, обл. Добрич",28320
62089,"с. Раковски, общ. Разград, обл. Разград",38224
62102,"с. Раковсково, общ. Несебър, обл. Бургас",19855
62116,"с. Ралево, общ. Плевен, обл. Плевен",21510
62120,"с. Ралевци, общ. Трявна, обл. Габрово",0
62133,"с. Ралиновци, общ. Елена, обл. Велико Търново",0
62147,"с. Ралица, общ. Момчилград, обл. Кърджали",4694
62164,"с. Ралица, общ. Търговище, обл. Търговище",12173
62178,"с. Раличево, общ. Крумовград, обл. Кърджали",0
62181,"с. Раненци, общ. Кюстендил, обл. Кюстендил",43962
62195,"с. Рани лист, общ. Кърджали, обл. Кърджали",13943
62205,"с. Рани луг, общ. Трън, обл. Перник",7516
62219,"с. Расник, общ. Перник, обл. Перник",21013
62222,"с. Расово, общ. Медковец, обл. Монтана",46413
62236,"с. Растник, общ. Кирково, обл. Кърджали",2773
62245,"с. Раховци, общ. Габрово, обл. Габрово",0
62253,"с. Рачевци, общ. Габрово, обл. Габрово",0
62267,"с. Рачовци, общ. Трявна, обл. Габрово",0
62270,"с. Рашевци, общ. Велико Търново, обл. Велико Търново",0
62284,"с. Рашка Гращица, общ. Невестино, обл. Кюстендил",11866
62298,"с. Рашково, общ. Ботевград, обл. София",31188
62308,"с. Рашовите, общ. Трявна, обл. Габрово",0
62311,"с. Рашовица, общ. Берковица, обл. Монтана",2842
62325,"с. Раювци, общ. Елена, обл. Велико Търново",0
62339,"с. Раяновци, общ. Белоградчик, обл. Видин",48151
62342,"с. Раяновци, общ. Драгоман, обл. София",12374
62356,"с. Раянци, общ. Земен, обл. Перник",12786
62360,"с. Ребревци, общ. Елена, обл. Велико Търново",0
62373,"с. Ребро, общ. Брезник, обл. Перник",11554
62387,"с. Реброво, общ. Своге, обл. София",15534
62390,"с. Ребърково, общ. Мездра, обл. Враца",8553
62400,"с. Редешковци, общ. Габрово, обл. Габрово",0
62414,"с. Редина, общ. Своге, обл. София",16749
17796,"с. Режанци, общ. Брезник, обл. Перник",11730
62428,"с. Режинци, общ. Кюстендил, обл. Кюстендил",3790
62431,"с. Резач, общ. Златарица, обл. Велико Търново",10540
62445,"с. Резбарци, общ. Кърджали, обл. Кърджали",2823
62459,"с. Резово, общ. Царево, обл. Бургас",48064
62462,"с. Река, общ. Смолян, обл. Смолян",7237
62476,"с. Рекичка, общ. Златарица, обл. Велико Търново",0
62486,"с. Рельово, общ. Самоков, обл. София",40566
62493,"с. Репляна, общ. Чупрене, обл. Видин",37578
62503,"с. Реселец, общ. Червен бряг, обл. Плевен",32598
62517,"с. Ресен, общ. Велико Търново, обл. Велико Търново",49866
62520,"с. Ресилово, общ. Сапарева баня, обл. Кюстендил",28331
62534,"с. Речани, общ. Смолян, обл. Смолян",0
62548,"с. Речица, общ. Руен, обл. Бургас",10753
62565,"с. Реяновци, общ. Трън, обл. Перник",3650
62582,"с. Рибарица, общ. Етрополе, обл. София",20260
62579,"с. Рибарица, общ. Тетевен, обл. Ловеч",216112
54260,"с. Рибарци, общ. Ардино, обл. Кърджали",1997
62606,"с. Рибен дол, общ. Баните, обл. Смолян",17921
62596,"с. Рибен, общ. Долна Митрополия, обл. Плевен",35042
62617,"с. Рибино, общ. Крумовград, обл. Кърджали",12364
62623,"с. Рибник, общ. Петрич, обл. Благоевград",3907
62637,"с. Рибница, общ. Рудозем, обл. Смолян",14598
62640,"с. Рибново, общ. Гърмен, обл. Благоевград",30086
62654,"с. Ридино, общ. Джебел, обл. Кърджали",12940
62668,"с. Ридово, общ. Кърджали, обл. Кърджали",1056
62699,"с. Рилци, общ. Благоевград, обл. Благоевград",4854
62712,"с. Рисиманово, общ. Раднево, обл. Стара Загора",6879
62726,"с. Ритя, общ. Дряново, обл. Габрово",0
62732,"с. Риш, общ. Смядово, обл. Шумен",64212
62757,"с. Робово, общ. Тунджа, обл. Ямбол",14238
62760,"с. Ровина, общ. Смолян, обл. Смолян",0
62774,"с. Рогач, общ. Крумовград, обл. Кърджали",10411
62788,"с. Рогачево, общ. Балчик, обл. Добрич",19240
62791,"с. Роглец, общ. Ружинци, обл. Видин",0
62801,"с. Рогозари, общ. Джебел, обл. Кърджали",2854
62815,"с. Рогозен, общ. Хайредин, обл. Враца",30436
62829,"с. Рогозина, общ. Генерал Тошево, обл. Добрич",26493
62832,"с. Рогозиново, общ. Харманли, обл. Хасково",27367
62846,"с. Рогозче, общ. Джебел, обл. Кърджали",5596
62858,"с. Рогош, общ. Марица, обл. Пловдив",27538
62877,"с. Родина, общ. Златарица, обл. Велико Търново",19527
62880,"с. Родопи, общ. Хасково, обл. Хасково",12304
62894,"с. Родопско, общ. Ардино, обл. Кърджали",3014
62904,"с. Рожден, общ. Руен, обл. Бургас",23642
63714,"с. Рожденско, общ. Джебел, обл. Кърджали",3044
62918,"с. Рожен, общ. Сандански, обл. Благоевград",8987
62921,"с. Роза, общ. Тунджа, обл. Ямбол",48570
62935,"с. Розино, общ. Ивайловград, обл. Хасково",12323
62949,"с. Розино, общ. Карлово, обл. Пловдив",66453
62966,"с. Розовец, общ. Брезово, обл. Пловдив",48118
62973,"с. Розово, общ. Брацигово, обл. Пазарджик",26393
62983,"с. Розово, общ. Казанлък, обл. Стара Загора",21490
63001,"с. Ропот, общ. Годеч, обл. София",6860
63046,"с. Росен, общ. Генерал Тошево, обл. Добрич",18617
63032,"с. Росен, общ. Пазарджик, обл. Пазарджик",20867
63029,"с. Росен, общ. Созопол, обл. Бургас",38386
63063,"с. Росеново, общ. Добрич-селска, обл. Добрич",19646
63055,"с. Росеново, общ. Средец, обл. Бургас",26585
63077,"с. Росина, общ. Търговище, обл. Търговище",12997
63094,"с. Росица, общ. Генерал Тошево, обл. Добрич",64615
63104,"с. Росица, общ. Омуртаг, обл. Търговище",4222
63080,"с. Росица, общ. Павликени, обл. Велико Търново",7915
63118,"с. Росно, общ. Златарица, обл. Велико Търново",13167
63121,"с. Росоман, общ. Божурище, обл. София",9564
63687,"с. Рохлева, общ. Велинград, обл. Пазарджик",4931
63135,"с. Рояк, общ. Дългопол, обл. Варна",18472
63152,"с. Рударци, общ. Перник, обл. Перник",8466
63170,"с. Рудина, общ. Кърджали, обл. Кърджали",7159
63166,"с. Рудина, общ. Руен, обл. Бургас",7198
63197,"с. Рудник, общ. Долни чифлик, обл. Варна",19678
63210,"с. Руевци, общ. Трявна, обл. Габрово",0
63238,"с. Руен, общ. Куклен, обл. Пловдив",5837
63224,"с. Руен, общ. Руен, обл. Бургас",25877
63241,"с. Руец, общ. Търговище, обл. Търговище",16933
63255,"с. Ружинци, общ. Ружинци, обл. Видин",21597
63272,"с. Ружица, общ. Болярово, обл. Ямбол",18812
63269,"с. Ружица, общ. Никола Козлево, обл. Шумен",20088
63286,"с. Руйно, общ. Дулово, обл. Силистра",19547
63296,"с. Руйчовци, общ. Габрово, обл. Габрово",0
63301,"с. Руманя, общ. Стара Загора, обл. Стара Загора",9792
63313,"с. Румелия, общ. Маджарово, обл. Хасково",4115
63327,"с. Румянцево, общ. Луковит, обл. Ловеч",27277
63330,"с. Руня, общ. Дряново, обл. Габрово",0
49312,"с. Рупите, общ. Петрич, обл. Благоевград",9257
63344,"с. Рупките, общ. Чирпан, обл. Стара Загора",31466
63358,"с. Рупци, общ. Видин, обл. Видин",8368
63361,"с. Рупци, общ. Червен бряг, обл. Плевен",20048
63375,"с. Рупча, общ. Руен, обл. Бургас",11975
63392,"с. Русалина, общ. Черноочене, обл. Кърджали",2317
63402,"с. Русалско, общ. Ардино, обл. Кърджали",7925
63416,"с. Русаля, общ. Велико Търново, обл. Велико Търново",20236
63447,"с. Русиновци, общ. Дряново, обл. Габрово",0
63450,"с. Руска Бела, общ. Мездра, обл. Враца",11765
63464,"с. Русковци, общ. Велико Търново, обл. Велико Търново",0
63478,"с. Русокастро, общ. Камено, обл. Бургас",47435
63481,"с. Рустан, общ. Мадан, обл. Смолян",0
63495,"с. Руховци, общ. Елена, обл. Велико Търново",9638
63505,"с. Ручей, общ. Крумовград, обл. Кърджали",5418
63519,"с. Ръжавец, общ. Брезник, обл. Перник",7632
63522,"с. Ръжана, общ. Ихтиман, обл. София",0
63542,"с. Ръждак, общ. Петрич, обл. Благоевград",0
63567,"с. Ръжево Конаре, общ. Калояново, обл. Пловдив",45418
63553,"с. Ръжево, общ. Калояново, обл. Пловдив",11319
63570,"с. Ръжена, общ. Казанлък, обл. Стара Загора",37828
63584,"с. Ръженово, общ. Маджарово, обл. Хасково",6647
63598,"с. Ръжица, общ. Руен, обл. Бургас",18493
63608,"с. Ръсово, общ. Кюстендил, обл. Кюстендил",9508
63611,"с. Рът, общ. Джебел, обл. Кърджали",3032
63639,"с. Рътлина, общ. Омуртаг, обл. Търговище",8114
63690,"с. Рязковци, общ. Габрово, обл. Габрово",0
63668,"с. Ряхово, общ. Сливо поле, обл. Русе",55009
63673,"с. Ряховците, общ. Севлиево, обл. Габрово",28880
65019,"с. Сава, общ. Дългопол, обл. Варна",16444
65022,"с. Савин, общ. Кубрат, обл. Разград",15144
65036,"с. Савино, общ. Тунджа, обл. Ямбол",20880
65047,"с. Савойски, общ. Кюстендил, обл. Кюстендил",18283
65067,"с. Садина, общ. Попово, обл. Търговище",61811
65070,"с. Садовец, общ. Долни Дъбник, обл. Плевен",61931
65084,"с. Садовик, общ. Брезник, обл. Перник",16016
65098,"с. Садовица, общ. Момчилград, обл. Кърджали",4710
65125,"с. Садово, общ. Аврен, обл. Варна",21159
65111,"с. Садово, общ. Сунгурларе, обл. Бургас",57211
65108,"с. Садово, общ. Хаджидимово, обл. Благоевград",11718
65142,"с. Сажденик, общ. Кюстендил, обл. Кюстендил",31241
65156,"с. Сакарци, общ. Тополовград, обл. Хасково",17105
65162,"с. Саласука, общ. Дряново, обл. Габрово",0
65173,"с. Салаш, общ. Белоградчик, обл. Видин",49803
65187,"с. Салманово, общ. Шумен, обл. Шумен",32303
65190,"с. Самовила, общ. Крумовград, обл. Кърджали",5952
65200,"с. Самоводене, общ. Велико Търново, обл. Велико Търново",42107
65214,"с. Самодива, общ. Кирково, обл. Кърджали",7040
65228,"с. Самокитка, общ. Кирково, обл. Кърджали",6423
65245,"с. Самораново, общ. Дупница, обл. Кюстендил",28574
65259,"с. Самотино, общ. Бяла, обл. Варна",18505
65262,"с. Самсиите, общ. Велико Търново, обл. Велико Търново",0
65276,"с. Самуил, общ. Самуил, обл. Разград",13731
65288,"с. Самуилова крепост, общ. Петрич, обл. Благоевград",0
00374,"с. Самуилово, общ. Добрич-селска, обл. Добрич",20981
65293,"с. Самуилово, общ. Петрич, обл. Благоевград",11979
65303,"с. Самуилово, общ. Сливен, обл. Сливен",17484
65317,"с. Самуилово, общ. Стара Загора, обл. Стара Загора",19416
65351,"с. Сан-Стефано, общ. Карнобат, обл. Бургас",21793
65320,"с. Санадиново, общ. Никопол, обл. Плевен",53962
65348,"с. Сандрово, общ. Русе, обл. Русе",27646
65379,"с. Сапарево, общ. Сапарева баня, обл. Кюстендил",54046
65396,"с. Сараево, общ. Мизия, обл. Враца",3835
65406,"с. Саранско, общ. Стралджа, обл. Ямбол",13146
65419,"с. Саранци, общ. Горна Малина, обл. София",8651
65437,"с. Сарая, общ. Пазарджик, обл. Пазарджик",12618
65440,"с. Сатовча, общ. Сатовча, обл. Благоевград",55373
65454,"с. Сбор, общ. Крумовград, обл. Кърджали",15481
65468,"с. Сбор, общ. Пазарджик, обл. Пазарджик",27767
65485,"с. Сборино, общ. Ивайловград, обл. Хасково",2860
65499,"с. Сборище, общ. Твърдица, обл. Сливен",50762
65509,"с. Сваленик, общ. Иваново, обл. Русе",42736
65512,"с. Сватбаре, общ. Кърджали, обл. Кърджали",1881
65526,"с. Свежен, общ. Брезово, обл. Пловдив",59985
65534,"с. Света Петка, общ. Велинград, обл. Пазарджик",55689
65543,"с. Свети Никола, общ. Каварна, обл. Добрич",19616
87816,"с. Свети Спас, общ. Долна баня, обл. София",0
35016,"с. Светлен, общ. Кирково, обл. Кърджали",5935
65557,"с. Светлен, общ. Попово, обл. Търговище",31051
65574,"с. Светлина, общ. Димитровград, обл. Хасково",9134
65560,"с. Светлина, общ. Средец, обл. Бургас",26717
65588,"с. Светлина, общ. Тополовград, обл. Хасково",30359
65591,"с. Светля, общ. Ковачевци, обл. Перник",9377
65601,"с. Световрачене, общ. Столична, обл. София (столица)",4958
65615,"с. Светослав, общ. Кайнарджа, обл. Силистра",18781
65629,"с. Светослав, общ. Стамболово, обл. Хасково",8150
65632,"с. Светославци, общ. Елена, обл. Велико Търново",0
65646,"с. Светулка, общ. Ардино, обл. Кърджали",7624
65650,"с. Свещари, общ. Исперих, обл. Разград",22459
65663,"с. Свидня, общ. Своге, обл. София",17048
65680,"с. Свинарски дол, общ. Габрово, обл. Габрово",0
65704,"с. Свирачи, общ. Ивайловград, обл. Хасково",18505
65721,"с. Свирково, общ. Симеоновград, обл. Хасково",30575
65735,"с. Свирци, общ. Трявна, обл. Габрово",0
65752,"с. Свирчово, общ. Антоново, обл. Търговище",15269
65824,"с. Свобода, общ. Добрич-селска, обл. Добрич",21785
65783,"с. Свобода, общ. Камено, обл. Бургас",0
65797,"с. Свобода, общ. Момчилград, обл. Кърджали",4848
65807,"с. Свобода, общ. Стрелча, обл. Пазарджик",25352
65810,"с. Свобода, общ. Чирпан, обл. Стара Загора",37874
65838,"с. Свободен, общ. Раднево, обл. Стара Загора",19079
65841,"с. Свободиново, общ. Черноочене, обл. Кърджали",4937
65855,"с. Свободица, общ. Антоново, обл. Търговище",1624
65872,"с. Своде, общ. Правец, обл. София",25479
65886,"с. Севар, общ. Кубрат, обл. Разград",33212
65890,"с. Севдалина, общ. Кърджали, обл. Кърджали",916
65906,"с. Северняк, общ. Крушари, обл. Добрич",10270
65913,"с. Северци, общ. Крушари, обл. Добрич",11553
65930,"с. Седелец, общ. Струмяни, обл. Благоевград",13059
65944,"с. Седефче, общ. Момчилград, обл. Кърджали",6602
65958,"с. Седларево, общ. Котел, обл. Сливен",16662
65961,"с. Седлари, общ. Момчилград, обл. Кърджали",2366
70771,"с. Седларци, общ. Ардино, обл. Кърджали",1837
65975,"с. Седловина, общ. Кърджали, обл. Кърджали",7019
65989,"с. Седянковци, общ. Габрово, обл. Габрово",0
65992,"с. Сейдол, общ. Лозница, обл. Разград",13406
66007,"с. Сейковци, общ. Габрово, обл. Габрово",0
66010,"с. Сеймените, общ. Велико Търново, обл. Велико Търново",0
66024,"с. Секирка, общ. Кирково, обл. Кърджали",2961
66038,"с. Секулово, общ. Дулово, обл. Силистра",28912
70723,"с. Селановци, общ. Оряхово, обл. Враца",110218
66041,"с. Селиминово, общ. Сливен, обл. Сливен",17973
66055,"с. Селище, общ. Благоевград, обл. Благоевград",13940
70799,"с. Селище, общ. Севлиево, обл. Габрово",0
66069,"с. Селище, общ. Смолян, обл. Смолян",3752
66072,"с. Селищен дол, общ. Перник, обл. Перник",11500
66086,"с. Селска поляна, общ. Маджарово, обл. Хасково",14681
66113,"с. Селце, общ. Каварна, обл. Добрич",15902
66103,"с. Селце, общ. Мъглиж, обл. Стара Загора",59730
66127,"с. Селци, общ. Садово, обл. Пловдив",11182
66130,"с. Селча, общ. Девин, обл. Смолян",23678
66144,"с. Селянин, общ. Ихтиман, обл. София",0
66158,"с. Семерджиево, общ. Русе, обл. Русе",28327
66161,"с. Семерджиите, общ. Габрово, обл. Габрово",0
66175,"с. Семерци, общ. Антоново, обл. Търговище",9082
66189,"с. Семковци, общ. Велико Търново, обл. Велико Търново",0
66202,"с. Семчиново, общ. Септември, обл. Пазарджик",27595
66216,"с. Сенник, общ. Севлиево, обл. Габрово",32093
66233,"с. Сеноклас, общ. Маджарово, обл. Хасково",29644
66250,"с. Сенокос, общ. Балчик, обл. Добрич",23945
66247,"с. Сенокос, общ. Симитли, обл. Благоевград",47084
70785,"с. Сенце, общ. Момчилград, обл. Кърджали",6077
16184,"с. Септемврийци, общ. Вълчедръм, обл. Монтана",46209
66278,"с. Септемврийци, общ. Димово, обл. Видин",16670
66281,"с. Септемврийци, общ. Каварна, обл. Добрич",29922
66295,"с. Сеслав, общ. Кубрат, обл. Разград",21398
66319,"с. Сестримо, общ. Белово, обл. Пазарджик",110767
66336,"с. Сестринско, общ. Кърджали, обл. Кърджали",1732
66344,"с. Сечен камък, общ. Трявна, обл. Габрово",0
66353,"с. Сечище, общ. Нови пазар, обл. Шумен",10941
66398,"с. Сив кладенец, общ. Ивайловград, обл. Хасково",8632
