EKATTE_ID,SETTLEMENT_NAME,AREA(DECARS)
00151,"гр. Айтос, общ. Айтос, обл. Бургас",79033
00182,"гр. Аксаково, общ. Аксаково, обл. Варна",18958
00415,"гр. Алфатар, общ. Алфатар, обл. Силистра",105443
00518,"гр. Антоново, общ. Антоново, обл. Търговище",25076
52218,"гр. Априлци, общ. Априлци, обл. Ловеч",203099
00607,"гр. Ардино, общ. Ардино, обл. Кърджали",15328
00702,"гр. Асеновград, общ. Асеновград, обл. Пловдив",78012
00833,"гр. Ахелой, общ. Поморие, обл. Бургас",13200
00878,"гр. Ахтопол, общ. Царево, обл. Бургас",28704
02508,"гр. Балчик, общ. Балчик, обл. Добрич",74411
02659,"гр. Банкя, общ. Столична, обл. София (столица)",33002
02676,"гр. Банско, общ. Банско, обл. Благоевград",148280
02720,"гр. Баня, общ. Карлово, обл. Пловдив",14459
02837,"гр. Батак, общ. Батак, обл. Пазарджик",461105
72223,"гр. Батановци, общ. Перник, обл. Перник",20634
03366,"гр. Белене, общ. Белене, обл. Плевен",146310
03504,"гр. Белица, общ. Белица, обл. Благоевград",72923
03592,"гр. Белово, общ. Белово, обл. Пазарджик",135307
03616,"гр. Белоградчик, общ. Белоградчик, обл. Видин",22234
03719,"гр. Белослав, общ. Белослав, обл. Варна",38370
03928,"гр. Берковица, общ. Берковица, обл. Монтана",80655
04279,"гр. Благоевград, общ. Благоевград, обл. Благоевград",28909
04501,"гр. Бобов дол, общ. Бобов дол, обл. Кюстендил",18286
04532,"гр. Бобошево, общ. Бобошево, обл. Кюстендил",22931
05027,"гр. Божурище, общ. Божурище, обл. София",0
05236,"гр. Бойчиновци, общ. Бойчиновци, обл. Монтана",16609
05284,"гр. Болярово, общ. Болярово, обл. Ямбол",39395
05611,"гр. Борово, общ. Борово, обл. Русе",37264
05815,"гр. Ботевград, общ. Ботевград, обл. София",53298
06207,"гр. Брацигово, общ. Брацигово, обл. Пазарджик",26199
06224,"гр. Брегово, общ. Брегово, обл. Видин",46476
06286,"гр. Брезник, общ. Брезник, обл. Перник",23481
06361,"гр. Брезово, общ. Брезово, обл. Пловдив",49962
06570,"гр. Брусарци, общ. Брусарци, обл. Монтана",20840
07079,"гр. Бургас, общ. Бургас, обл. Бургас",284442
07140,"гр. Бухово, общ. Столична, обл. София (столица)",44821
07332,"гр. Българово, общ. Бургас, обл. Бургас",52035
07702,"гр. Бяла Слатина, общ. Бяла Слатина, обл. Враца",82383
07716,"гр. Бяла черква, общ. Павликени, обл. Велико Търново",38538
07598,"гр. Бяла, общ. Бяла, обл. Варна",42859
07603,"гр. Бяла, общ. Бяла, обл. Русе",86862
10135,"гр. Варна, общ. Варна, обл. Варна",153751
58222,"гр. Велики Преслав, общ. Велики Преслав, обл. Шумен",76763
10447,"гр. Велико Търново, общ. Велико Търново, обл. Велико Търново",30379
10450,"гр. Велинград, общ. Велинград, обл. Пазарджик",124955
10803,"гр. Ветово, общ. Ветово, обл. Русе",86801
10820,"гр. Ветрен, общ. Септември, обл. Пазарджик",64545
10971,"гр. Видин, общ. Видин, обл. Видин",63218
12259,"гр. Враца, общ. Враца, обл. Враца",148924
12543,"гр. Вълчедръм, общ. Вълчедръм, обл. Монтана",121134
12574,"гр. Вълчи дол, общ. Вълчи дол, обл. Варна",18695
12766,"гр. Върбица, общ. Върбица, обл. Шумен",75801
12961,"гр. Вършец, общ. Вършец, обл. Монтана",81960
14218,"гр. Габрово, общ. Габрово, обл. Габрово",233817
14711,"гр. Генерал Тошево, общ. Генерал Тошево, обл. Добрич",63655
15031,"гр. Главиница, общ. Главиница, обл. Силистра",34844
15151,"гр. Глоджево, общ. Ветово, обл. Русе",76136
15309,"гр. Годеч, общ. Годеч, обл. София",56305
16359,"гр. Горна Оряховица, общ. Горна Оряховица, обл. Велико Търново",21108
17395,"гр. Гоце Делчев, общ. Гоце Делчев, обл. Благоевград",21652
17645,"гр. Грамада, общ. Грамада, обл. Видин",65807
18099,"гр. Гулянци, общ. Гулянци, обл. Плевен",70079
18157,"гр. Гурково, общ. Гурково, обл. Стара Загора",58323
18280,"гр. Гълъбово, общ. Гълъбово, обл. Стара Загора",59947
20184,"гр. Две могили, общ. Две могили, обл. Русе",39769
20242,"гр. Дебелец, общ. Велико Търново, обл. Велико Търново",26375
20465,"гр. Девин, общ. Девин, обл. Смолян",134832
20482,"гр. Девня, общ. Девня, обл. Варна",83621
20746,"гр. Джебел, общ. Джебел, обл. Кърджали",9041
21052,"гр. Димитровград, общ. Димитровград, обл. Хасково",62436
21097,"гр. Димово, общ. Димово, обл. Видин",15975
21498,"гр. Добринище, общ. Банско, обл. Благоевград",80356
72624,"гр. Добрич, общ. Добрич, обл. Добрич",109018
22215,"гр. Долна Митрополия, общ. Долна Митрополия, обл. Плевен",31824
22232,"гр. Долна Оряховица, общ. Горна Оряховица, обл. Велико Търново",35551
22006,"гр. Долна баня, общ. Долна баня, обл. София",66854
22407,"гр. Долни Дъбник, общ. Долни Дъбник, обл. Плевен",75247
21912,"гр. Долни чифлик, общ. Долни чифлик, обл. Варна",34842
23025,"гр. Доспат, общ. Доспат, обл. Смолян",69196
23409,"гр. Драгоман, общ. Драгоман, обл. София",34475
23947,"гр. Дряново, общ. Дряново, обл. Габрово",28096
24030,"гр. Дулово, общ. Дулово, обл. Силистра",19582
24061,"гр. Дунавци, общ. Видин, обл. Видин",31005
68789,"гр. Дупница, общ. Дупница, обл. Кюстендил",32321
24565,"гр. Дългопол, общ. Дългопол, обл. Варна",57881
27190,"гр. Елена, общ. Елена, обл. Велико Търново",62420
27303,"гр. Елин Пелин, общ. Елин Пелин, обл. София",29098
27382,"гр. Елхово, общ. Елхово, обл. Ямбол",49883
27632,"гр. Етрополе, общ. Етрополе, обл. София",119135
30065,"гр. Завет, общ. Завет, обл. Разград",59738
30778,"гр. Земен, общ. Земен, обл. Перник",21250
30962,"гр. Златарица, общ. Златарица, обл. Велико Търново",49557
31044,"гр. Златица, общ. Златица, обл. София",67538
31111,"гр. Златоград, общ. Златоград, обл. Смолян",65117
32024,"гр. Ивайловград, общ. Ивайловград, обл. Хасково",46117
32278,"гр. Игнатиево, общ. Аксаково, обл. Варна",25841
55782,"гр. Искър, общ. Искър, обл. Плевен",75324
32874,"гр. Исперих, общ. Исперих, обл. Разград",35735
32901,"гр. Ихтиман, общ. Ихтиман, обл. София",90891
35033,"гр. Каблешково, общ. Поморие, обл. Бургас",52514
35064,"гр. Каварна, общ. Каварна, обл. Добрич",46448
35167,"гр. Казанлък, общ. Казанлък, обл. Стара Загора",36067
35496,"гр. Калофер, общ. Карлово, обл. Пловдив",155016
35883,"гр. Камено, общ. Камено, обл. Бургас",59287
36079,"гр. Каолиново, общ. Каолиново, обл. Шумен",31314
36498,"гр. Карлово, общ. Карлово, обл. Пловдив",102173
36525,"гр. Карнобат, общ. Карнобат, обл. Бургас",109657
36587,"гр. Каспичан, общ. Каспичан, обл. Шумен",40320
36779,"гр. Кермен, общ. Сливен, обл. Сливен",42120
36837,"гр. Килифарево, общ. Велико Търново, обл. Велико Търново",28989
37023,"гр. Китен, общ. Приморско, обл. Бургас",17003
37277,"гр. Клисура, общ. Карлово, обл. Пловдив",131402
37376,"гр. Кнежа, общ. Кнежа, обл. Плевен",178162
37798,"гр. Козлодуй, общ. Козлодуй, обл. Враца",105307
37863,"гр. Койнаре, общ. Червен бряг, обл. Плевен",81574
38558,"гр. Копривщица, общ. Копривщица, обл. София",139165
38844,"гр. Костандово, общ. Ракитово, обл. Пазарджик",49880
38902,"гр. Костенец, общ. Костенец, обл. София",0
38978,"гр. Костинброд, общ. Костинброд, обл. София",41405
39030,"гр. Котел, общ. Котел, обл. Сливен",131519
39116,"гр. Кочериново, общ. Кочериново, обл. Кюстендил",18515
14492,"гр. Кресна, общ. Кресна, обл. Благоевград",56467
39846,"гр. Криводол, общ. Криводол, обл. Враца",36625
39921,"гр. Кричим, общ. Кричим, обл. Пловдив",54895
39970,"гр. Крумовград, общ. Крумовград, обл. Кърджали",5144
40292,"гр. Крън, общ. Казанлък, обл. Стара Загора",28750
40422,"гр. Кубрат, общ. Кубрат, обл. Разград",56846
40467,"гр. Куклен, общ. Куклен, обл. Пловдив",31524
40525,"гр. Кула, общ. Кула, обл. Видин",63738
40909,"гр. Кърджали, общ. Кърджали, обл. Кърджали",30759
41112,"гр. Кюстендил, общ. Кюстендил, обл. Кюстендил",18720
43236,"гр. Левски, общ. Левски, обл. Плевен",30717
43476,"гр. Летница, общ. Летница, обл. Ловеч",68515
43952,"гр. Ловеч, общ. Ловеч, обл. Ловеч",69492
44166,"гр. Лозница, общ. Лозница, обл. Разград",24130
44238,"гр. Лом, общ. Лом, обл. Монтана",52203
44327,"гр. Луковит, общ. Луковит, обл. Ловеч",89115
44478,"гр. Лъки, общ. Лъки, обл. Пловдив",9779
44570,"гр. Любимец, общ. Любимец, обл. Хасково",57374
44793,"гр. Лясковец, общ. Лясковец, обл. Велико Търново",49472
46045,"гр. Мадан, общ. Мадан, обл. Смолян",22353
46084,"гр. Маджарово, общ. Маджарово, обл. Хасково",20167
46663,"гр. Малко Търново, общ. Малко Търново, обл. Бургас",137687
47336,"гр. Мартен, общ. Русе, обл. Русе",31998
47714,"гр. Мездра, общ. Мездра, обл. Враца",5343
47754,"гр. Мелник, общ. Сандански, обл. Благоевград",6464
47843,"гр. Меричлери, общ. Димитровград, обл. Хасково",46222
48043,"гр. Мизия, общ. Мизия, обл. Враца",64373
50245,"гр. Момин проход, общ. Костенец, обл. София",0
48996,"гр. Момчилград, общ. Момчилград, обл. Кърджали",16198
48489,"гр. Монтана, общ. Монтана, обл. Монтана",69235
49494,"гр. Мъглиж, общ. Мъглиж, обл. Стара Загора",73923
51319,"гр. Неделино, общ. Неделино, обл. Смолян",43330
51500,"гр. Несебър, общ. Несебър, обл. Бургас",31852
51648,"гр. Николаево, общ. Николаево, обл. Стара Загора",14867
51723,"гр. Никопол, общ. Никопол, обл. Плевен",35185
51809,"гр. Нова Загора, общ. Нова Загора, обл. Сливен",24449
00357,"гр. Нови Искър, общ. Столична, обл. София (столица)",52808
52009,"гр. Нови пазар, общ. Нови пазар, обл. Шумен",35622
53045,"гр. Обзор, общ. Несебър, обл. Бургас",36779
53535,"гр. Омуртаг, общ. Омуртаг, обл. Търговище",23639
53552,"гр. Опака, общ. Опака, обл. Търговище",56940
54020,"гр. Оряхово, общ. Оряхово, обл. Враца",50792
55021,"гр. Павел баня, общ. Павел баня, обл. Стара Загора",28526
55052,"гр. Павликени, общ. Павликени, обл. Велико Търново",42221
55155,"гр. Пазарджик, общ. Пазарджик, обл. Пазарджик",37382
55302,"гр. Панагюрище, общ. Панагюрище, обл. Пазарджик",221779
55871,"гр. Перник, общ. Перник, обл. Перник",72289
55909,"гр. Перущица, общ. Перущица, обл. Пловдив",48719
56126,"гр. Петрич, общ. Петрич, обл. Благоевград",80421
56277,"гр. Пещера, общ. Пещера, обл. Пазарджик",90245
56407,"гр. Пирдоп, общ. Пирдоп, обл. София",90148
56719,"гр. Плачковци, общ. Трявна, обл. Габрово",34669
56722,"гр. Плевен, общ. Плевен, обл. Плевен",85087
56770,"гр. Плиска, общ. Каспичан, обл. Шумен",34356
56784,"гр. Пловдив, общ. Пловдив, обл. Пловдив",101981
57354,"гр. Полски Тръмбеш, общ. Полски Тръмбеш, обл. Велико Търново",17172
57491,"гр. Поморие, общ. Поморие, обл. Бургас",49879
57649,"гр. Попово, общ. Попово, обл. Търговище",42214
57772,"гр. Пордим, общ. Пордим, обл. Плевен",47231
58030,"гр. Правец, общ. Правец, обл. София",46073
58356,"гр. Приморско, общ. Приморско, обл. Бургас",69415
58503,"гр. Провадия, общ. Провадия, обл. Варна",21738
59080,"гр. Първомай, общ. Първомай, обл. Пловдив",75485
61460,"гр. Раднево, общ. Раднево, обл. Стара Загора",84509
61577,"гр. Радомир, общ. Радомир, обл. Перник",47499
61710,"гр. Разград, общ. Разград, обл. Разград",92845
61813,"гр. Разлог, общ. Разлог, обл. Благоевград",221114
62004,"гр. Ракитово, общ. Ракитово, обл. Пазарджик",117099
62075,"гр. Раковски, общ. Раковски, обл. Пловдив",97999
62671,"гр. Рила, общ. Рила, обл. Кюстендил",58156
62997,"гр. Роман, общ. Роман, обл. Враца",15871
63207,"гр. Рудозем, общ. Рудозем, обл. Смолян",36685
63427,"гр. Русе, общ. Русе, обл. Русе",127124
65139,"гр. Садово, общ. Садово, обл. Пловдив",15482
65231,"гр. Самоков, общ. Самоков, обл. София",128982
65334,"гр. Сандански, общ. Сандански, обл. Благоевград",26867
65365,"гр. Сапарева баня, общ. Сапарева баня, обл. Кюстендил",79720
11538,"гр. Свети Влас, общ. Несебър, обл. Бургас",36125
65677,"гр. Свиленград, общ. Свиленград, обл. Хасково",79686
65766,"гр. Свищов, общ. Свищов, обл. Велико Търново",110271
65869,"гр. Своге, общ. Своге, обл. София",21932
65927,"гр. Севлиево, общ. Севлиево, обл. Габрово",41244
66229,"гр. Сеново, общ. Ветово, обл. Русе",47106
66264,"гр. Септември, общ. Септември, обл. Пазарджик",22454
66425,"гр. Силистра, общ. Силистра, обл. Силистра",27159
47278,"гр. Симеоновград, общ. Симеоновград, обл. Хасково",77159
66460,"гр. Симитли, общ. Симитли, обл. Благоевград",36366
67088,"гр. Славяново, общ. Плевен, обл. Плевен",93454
67338,"гр. Сливен, общ. Сливен, обл. Сливен",193778
67372,"гр. Сливница, общ. Сливница, обл. София",42816
67444,"гр. Сливо поле, общ. Сливо поле, обл. Русе",36233
67653,"гр. Смолян, общ. Смолян, обл. Смолян",134590
67708,"гр. Смядово, общ. Смядово, обл. Шумен",96758
67800,"гр. Созопол, общ. Созопол, обл. Бургас",41829
68080,"гр. Сопот, общ. Сопот, обл. Пловдив",36370
68134,"гр. София, общ. Столична, обл. София (столица)",492029
17974,"гр. Средец, общ. Средец, обл. Бургас",63216
51980,"гр. Стамболийски, общ. Стамболийски, обл. Пловдив",14235
68850,"гр. Стара Загора, общ. Стара Загора, обл. Стара Загора",85786
69633,"гр. Стражица, общ. Стражица, обл. Велико Търново",50073
69660,"гр. Стралджа, общ. Стралджа, обл. Ямбол",79305
69835,"гр. Стрелча, общ. Стрелча, обл. Пазарджик",119018
70175,"гр. Суворово, общ. Суворово, обл. Варна",58075
70247,"гр. Сунгурларе, общ. Сунгурларе, обл. Бургас",50290
70295,"гр. Сухиндол, общ. Сухиндол, обл. Велико Търново",65798
70528,"гр. Съединение, общ. Съединение, обл. Пловдив",100200
70648,"гр. Сърница, общ. Сърница, обл. Пазарджик",112378
72165,"гр. Твърдица, общ. Твърдица, обл. Сливен",155167
72271,"гр. Тервел, общ. Тервел, обл. Добрич",43589
72343,"гр. Тетевен, общ. Тетевен, обл. Ловеч",110788
72761,"гр. Тополовград, общ. Тополовград, обл. Хасково",96815
73198,"гр. Троян, общ. Троян, обл. Ловеч",60243
73273,"гр. Трън, общ. Трън, обл. Перник",21582
73359,"гр. Тръстеник, общ. Долна Митрополия, обл. Плевен",88710
73403,"гр. Трявна, общ. Трявна, обл. Габрово",16122
73496,"гр. Тутракан, общ. Тутракан, обл. Силистра",64444
73626,"гр. Търговище, общ. Търговище, обл. Търговище",87427
75054,"гр. Угърчин, общ. Угърчин, обл. Ловеч",134806
77058,"гр. Хаджидимово, общ. Хаджидимово, обл. Благоевград",22671
77181,"гр. Харманли, общ. Харманли, обл. Хасково",51477
77195,"гр. Хасково, общ. Хасково, обл. Хасково",95182
77270,"гр. Хисаря, общ. Хисаря, обл. Пловдив",90115
77308,"гр. Цар Калоян, общ. Цар Калоян, обл. Разград",69518
48619,"гр. Царево, общ. Царево, обл. Бургас",35179
80371,"гр. Чепеларе, общ. Чепеларе, обл. Смолян",73861
80501,"гр. Червен бряг, общ. Червен бряг, обл. Плевен",40760
81178,"гр. Черноморец, общ. Созопол, обл. Бургас",30561
81390,"гр. Чипровци, общ. Чипровци, обл. Монтана",65467
81414,"гр. Чирпан, общ. Чирпан, обл. Стара Загора",73163
83017,"гр. Шабла, общ. Шабла, обл. Добрич",70087
15944,"гр. Шивачево, общ. Твърдица, обл. Сливен",78359
83199,"гр. Шипка, общ. Казанлък, обл. Стара Загора",37988
83510,"гр. Шумен, общ. Шумен, обл. Шумен",136358
87014,"гр. Ябланица, общ. Ябланица, обл. Ловеч",57842
87338,"гр. Якоруда, общ. Якоруда, обл. Благоевград",254031
87374,"гр. Ямбол, общ. Ямбол, обл. Ямбол",90724
37318,"ман. Клисурски манастир, общ. Вършец, обл. Монтана",0
62685,"ман. Рилски манастир, общ. Рила, обл. Кюстендил",231600
00881,"с. Абланица, общ. Велинград, обл. Пазарджик",11874
00028,"с. Абланица, общ. Ловеч, обл. Ловеч",23610
00014,"с. Абланица, общ. Хаджидимово, обл. Благоевград",33663
00031,"с. Абрит, общ. Крушари, обл. Добрич",19673
00062,"с. Аврамово, общ. Ардино, обл. Кърджали",6197
00059,"с. Аврамово, общ. Якоруда, обл. Благоевград",5284
00084,"с. Аврен, общ. Аврен, обл. Варна",58364
00093,"с. Аврен, общ. Крумовград, обл. Кърджали",35229
00103,"с. Агатово, общ. Севлиево, обл. Габрово",36488
00117,"с. Азманите, общ. Трявна, обл. Габрово",0
00895,"с. Айдемир, общ. Силистра, обл. Силистра",64745
00148,"с. Айрово, общ. Кърджали, обл. Кърджали",0
00165,"с. Аканджиево, общ. Белово, обл. Пазарджик",11606
00179,"с. Акациево, общ. Видин, обл. Видин",3486
00196,"с. Аламовци, общ. Златоград, обл. Смолян",18371
00206,"с. Албанци, общ. Джебел, обл. Кърджали",807
00215,"с. Алваново, общ. Търговище, обл. Търговище",14860
00223,"с. Алдомировци, общ. Сливница, обл. София",36582
00254,"с. Алеко Константиново, общ. Пазарджик, обл. Пазарджик",15864
00240,"с. Алеково, общ. Алфатар, обл. Силистра",49570
00237,"с. Алеково, общ. Свищов, обл. Велико Търново",34698
00268,"с. Александрия, общ. Крушари, обл. Добрич",35032
00299,"с. Александрово, общ. Ловеч, обл. Ловеч",41690
00309,"с. Александрово, общ. Павел баня, обл. Стара Загора",78630
00271,"с. Александрово, общ. Поморие, обл. Бургас",11093
00285,"с. Александрово, общ. Свищов, обл. Велико Търново",11686
00330,"с. Александрово, общ. Смядово, обл. Шумен",23943
00343,"с. Александрово, общ. Стралджа, обл. Ямбол",37264
00312,"с. Александрово, общ. Търговище, обл. Търговище",15469
00326,"с. Александрово, общ. Хасково, обл. Хасково",21601
00360,"с. Александър Стамболийски, общ. Генерал Тошево, обл. Добрич",27921
83421,"с. Алендарова, общ. Велинград, обл. Пазарджик",0
00388,"с. Алиговска, общ. Смолян, обл. Смолян",0
00391,"с. Алино, общ. Самоков, обл. София",48571
00401,"с. Алтимир, общ. Бяла Слатина, обл. Враца",32058
00429,"с. Алцек, общ. Добрич-селска, обл. Добрич",10271
00446,"с. Ангел войвода, общ. Минерални бани, обл. Хасково",12452
00432,"с. Ангеларий, общ. Тервел, обл. Добрич",12441
00456,"с. Ангелов, общ. Габрово, обл. Габрово",0
00480,"с. Анево, общ. Сопот, обл. Пловдив",19171
00919,"с. Антимово, общ. Видин, обл. Видин",11962
